{
  "eyes": [
    {
      "id": "eye_viewer_left",
      "mask": "work/reference_masks/eye_viewer_left.png",
      "closed_curve": [
        [
          347.0,
          435.0
        ],
        [
          351.06,
          439.89
        ],
        [
          355.41,
          444.4
        ],
        [
          360.01,
          448.53
        ],
        [
          364.85,
          452.27
        ],
        [
          369.91,
          455.62
        ],
        [
          375.16,
          458.6
        ],
        [
          380.57,
          461.19
        ],
        [
          386.13,
          463.4
        ],
        [
          391.8,
          465.22
        ],
        [
          397.58,
          466.67
        ],
        [
          403.43,
          467.74
        ],
        [
          409.33,
          468.42
        ],
        [
          415.26,
          468.72
        ],
        [
          421.19,
          468.65
        ],
        [
          427.11,
          468.2
        ],
        [
          432.98,
          467.37
        ],
        [
          438.79,
          466.16
        ],
        [
          444.52,
          464.57
        ],
        [
          450.13,
          462.61
        ],
        [
          455.61,
          460.27
        ],
        [
          460.93,
          457.56
        ],
        [
          466.06,
          454.46
        ],
        [
          471.0,
          451.0
        ]
      ],
      "stroke_width": 4.5,
      "margin": 1,
      "skin_color": [
        254,
        231,
        214
      ],
      "lashes": [
        [
          [
            354,
            442
          ],
          [
            349,
            434
          ],
          [
            345,
            431
          ]
        ],
        [
          [
            364,
            450
          ],
          [
            358,
            440
          ],
          [
            355,
            436
          ]
        ],
        [
          [
            375,
            458
          ],
          [
            370,
            450
          ],
          [
            368,
            446
          ]
        ]
      ],
      "already_closed": false
    },
    {
      "id": "eye_viewer_right",
      "mask": "work/reference_masks/eye_viewer_right.png",
      "closed_curve": [
        [
          587.0,
          483.0
        ],
        [
          589.92,
          488.45
        ],
        [
          593.2,
          493.57
        ],
        [
          596.8,
          498.36
        ],
        [
          600.71,
          502.8
        ],
        [
          604.91,
          506.89
        ],
        [
          609.37,
          510.62
        ],
        [
          614.08,
          513.97
        ],
        [
          619.0,
          516.95
        ],
        [
          624.11,
          519.54
        ],
        [
          629.41,
          521.73
        ],
        [
          634.85,
          523.51
        ],
        [
          640.43,
          524.88
        ],
        [
          646.11,
          525.83
        ],
        [
          651.88,
          526.34
        ],
        [
          657.71,
          526.41
        ],
        [
          663.59,
          526.03
        ],
        [
          669.48,
          525.19
        ],
        [
          675.37,
          523.88
        ],
        [
          681.23,
          522.09
        ],
        [
          687.05,
          519.82
        ],
        [
          692.8,
          517.06
        ],
        [
          698.46,
          513.78
        ],
        [
          704.0,
          510.0
        ]
      ],
      "stroke_width": 4.8,
      "margin": 1,
      "skin_color": [
        254,
        232,
        215
      ],
      "lashes": [
        [
          [
            696,
            516
          ],
          [
            702,
            510
          ],
          [
            704,
            508
          ]
        ],
        [
          [
            686,
            522
          ],
          [
            694,
            514
          ],
          [
            701,
            511
          ]
        ],
        [
          [
            675,
            526
          ],
          [
            684,
            520
          ],
          [
            688,
            517
          ]
        ]
      ],
      "already_closed": false
    }
  ],
  "mouth": {
    "id": "mouth",
    "mask": "work/reference_masks/mouth.png",
    "closed_curve": [
      [
        480.0,
        545.0
      ],
      [
        481.8,
        547.13
      ],
      [
        483.73,
        549.08
      ],
      [
        485.77,
        550.86
      ],
      [
        487.93,
        552.46
      ],
      [
        490.18,
        553.87
      ],
      [
        492.53,
        555.08
      ],
      [
        494.97,
        556.1
      ],
      [
        497.48,
        556.92
      ],
      [
        500.06,
        557.53
      ],
      [
        502.7,
        557.92
      ],
      [
        505.4,
        558.1
      ],
      [
        508.15,
        558.05
      ],
      [
        510.93,
        557.77
      ],
      [
        513.75,
        557.26
      ],
      [
        516.58,
        556.51
      ],
      [
        519.43,
        555.51
      ],
      [
        522.29,
        554.26
      ],
      [
        525.15,
        552.76
      ],
      [
        528.0,
        551.0
      ]
    ],
    "stroke_width": 2.2,
    "margin": 1,
    "already_closed": false
  },
  "flat_extra_masks": [],
  "inpaint_radius": 3
}
